create table t1 (a int) engine=myisam;
insert into t1 values (3), (7), (1);
with cte1 as (select a from t1) update cte1 set a=10;
select * from t1;
a
10
10
10
with cte1 as (select * from t1) update cte1 set a=14;
select * from t1;
a
14
14
14
with cte1 as (select * from t1) update cte1 set cte1.a=18 limit 1;
select * from t1;
a
18
14
14
with cte1 as (select * from t1) update cte1 set cte1.a=2 where a<18;
select * from t1;
a
18
2
2
with cte1 as (select * from (select * from t1) dt1)
update cte1 set cte1.a=22 where a>18;
select * from t1;
a
18
2
2
with cte1 as (select * from (select * from t1) dt1 where dt1.a > 17)
update cte1 set cte1.a=24;
select * from t1;
a
24
2
2
create view v1 as select * from t1 where t1.a < 10;
create view v2 as select * from v1;
update v2 set a=6;
select * from t1;
a
24
6
6
with cte1 as (select * from (select * from t1 where t1.a > 2) dt1 where dt1.a < 24)
update cte1 set cte1.a=4 limit 1;
select * from t1;
a
24
4
6
drop view v1, v2;
drop table t1;
create table t1 (a int);
insert into t1 values (1),(2),(3),(4),(7),(10);
create table t2 (b int);
insert into t2 values (4),(7),(1),(3),(11);
select * from t1;
a
1
2
3
4
7
10
select * from t2;
b
4
7
1
3
11
# CTEs with DTs
with cte1 as (select * from t1 where a <2) update cte1 set a=0;
select * from t1;
a
0
2
3
4
7
10
delete from t1;
insert into t1 values (1),(2),(3),(4),(7),(10);
with cte1 as (select * from t1 where a>2) update cte1 set a=0 where a<10;
select * from t1;
a
1
2
0
0
0
10
delete from t1;
insert into t1 values (1),(2),(3),(4),(7),(10);
with cte1 as (select * from (select * from t1) dt1) update cte1 set a=1 where a>2;
select * from t1;
a
1
2
1
1
1
1
delete from t1;
insert into t1 values (1),(2),(3),(4),(7),(10);
with cte1 as (select * from (select * from t1) dt1 where a>1)
update cte1 set a=9 where a>2;
select * from t1;
a
1
2
9
9
9
9
delete from t1;
insert into t1 values (1),(2),(3),(4),(7),(10);
with cte1 as (select * from (select * from (select * from t1) dt1) dt2)
update cte1 set a=2 where a>7;
select * from t1;
a
1
2
3
4
7
2
delete from t1;
insert into t1 values (1),(2),(3),(4),(7),(10);
with cte1 as (select * from (select * from (select * from t1) dt1) dt2 where a<8)
update cte1 set a=2 where a>3;
select * from t1;
a
1
2
3
2
2
10
delete from t1;
insert into t1 values (1),(2),(3),(4),(7),(10);
with cte1 as (select * from (select * from (select * from t1) dt1 where a>1) dt2 where a<11)
update cte1 set a=2 where a>6;
select * from t1;
a
1
2
3
4
2
2
delete from t1;
insert into t1 values (1),(2),(3),(4),(7),(10);
with cte1 as (select * from t1),
cte2 as (select * from cte1) update cte2 set a=9 where a>5;
select * from t1;
a
1
2
3
4
9
9
delete from t1;
insert into t1 values (1),(2),(3),(4),(7),(10);
with cte1 as (select * from t1 where a>2),
cte2 as (select * from cte1 where a>3) update cte2 set a=9 where a<9;
select * from t1;
a
1
2
3
9
9
10
delete from t1;
insert into t1 values (1),(2),(3),(4),(7),(10);
with cte1 as (select * from (select * from t1) dt1),
cte2 as (select * from cte1) update cte2 set a=9 where a>3;
select * from t1;
a
1
2
3
9
9
9
delete from t1;
insert into t1 values (1),(2),(3),(4),(7),(10);
with cte1 as (select * from (select * from t1) dt1 where a>2),
cte2 as (select * from cte1 where a>3) update cte2 set a=9 where a<9;
select * from t1;
a
1
2
3
9
9
10
delete from t1;
insert into t1 values (1),(2),(3),(4),(7),(10);
create view v1 as (select * from t1);
select * from v1;
a
1
2
3
4
7
10
# Simple view with CTEs
with cte1 as (select * from v1) update cte1 set a=20 where a>5;
select * from t1;
a
1
2
3
4
20
20
delete from t1;
insert into t1 values (1),(2),(3),(4),(7),(10);
with cte1 as (select * from v1 where a>3) update cte1 set a=0 where a<9;
select * from t1;
a
1
2
3
0
0
10
delete from t1;
insert into t1 values (1),(2),(3),(4),(7),(10);
with cte1 as (select * from (select * from v1) dt1) update cte1 set a=0 where a<7;
select * from t1;
a
0
0
0
0
7
10
delete from t1;
insert into t1 values (1),(2),(3),(4),(7),(10);
with cte1 as (select * from (select * from v1) dt1 where a>2) update cte1 set a=0 where a<7;
select * from t1;
a
1
2
0
0
7
10
delete from t1;
insert into t1 values (1),(2),(3),(4),(7),(10);
with cte1 as (select * from v1), cte2 as (select * from cte1)
update cte2 set a=11 where a>5;
select * from t1;
a
1
2
3
4
11
11
delete from t1;
insert into t1 values (1),(2),(3),(4),(7),(10);
with cte1 as (select * from v1 where a<7), cte2 as (select * from cte1)
update cte2 set a=11 where a>2;
select * from t1;
a
1
2
11
11
7
10
delete from t1;
insert into t1 values (1),(2),(3),(4),(7),(10);
with cte1 as (select * from v1 where a<7), cte2 as (select * from cte1 where a>3)
update cte2 set a=11 where a>2;
select * from t1;
a
1
2
3
11
7
10
delete from t1;
insert into t1 values (1),(2),(3),(4),(7),(10);
create view v2 as (select * from (select * from t2) dt1 where b < 10);
select * from v2;
b
4
7
1
3
# View having Embedded DT with CTEs
with cte1 as (select * from v2) update cte1 set b=20 where b>5;
select * from t2;
b
4
20
1
3
11
delete from t2;
insert into t2 values (4),(7),(1),(3),(11);
with cte1 as (select * from v2 where b>3) update cte1 set b=0 where b<9;
select * from t2;
b
0
0
1
3
11
delete from t2;
insert into t2 values (4),(7),(1),(3),(11);
with cte1 as (select * from (select * from v2) dt1) update cte1 set b=0 where b<7;
select * from t2;
b
0
7
0
0
11
delete from t2;
insert into t2 values (4),(7),(1),(3),(11);
with cte1 as (select * from (select * from v2) dt1 where b>2) update cte1 set b=0 where b<7;
select * from t2;
b
0
7
1
0
11
delete from t2;
insert into t2 values (4),(7),(1),(3),(11);
with cte1 as (select * from (select * from v2 where b>1) dt1 where b>2) update cte1 set b=0 where b<7;
select * from t2;
b
0
7
1
0
11
delete from t2;
insert into t2 values (4),(7),(1),(3),(11);
with cte1 as (select * from v2), cte2 as (select * from cte1)
update cte2 set b=11 where b>5;
select * from t2;
b
4
11
1
3
11
delete from t2;
insert into t2 values (4),(7),(1),(3),(11);
with cte1 as (select * from v2 where b<15), cte2 as (select * from cte1)
update cte2 set b=11 where b>5;
select * from t2;
b
4
11
1
3
11
delete from t2;
insert into t2 values (4),(7),(1),(3),(11);
with cte1 as (select * from v2 where b<15), cte2 as (select * from cte1 where b>3)
update cte2 set b=11 where b>2;
select * from t2;
b
11
11
1
3
11
delete from t2;
insert into t2 values (4),(7),(1),(3),(11);
create view v3 as (select * from v1 where a<7);
select * from v3;
a
1
2
3
4
# View having Embedded another simple view with CTEs
with cte1 as (select * from v3) update cte1 set a=20 where a>1;
select * from t1;
a
1
20
20
20
7
10
delete from t1;
insert into t1 values (1),(2),(3),(4),(7),(10);
with cte1 as (select * from v3 where a>3) update cte1 set a=0 where a<9;
select * from t1;
a
1
2
3
0
7
10
delete from t1;
insert into t1 values (1),(2),(3),(4),(7),(10);
with cte1 as (select * from (select * from v3) dt1) update cte1 set a=0 where a<4;
select * from t1;
a
0
0
0
4
7
10
delete from t1;
insert into t1 values (1),(2),(3),(4),(7),(10);
with cte1 as (select * from (select * from v3) dt1 where a>2) update cte1 set a=0 where a<4;
select * from t1;
a
1
2
0
4
7
10
delete from t1;
insert into t1 values (1),(2),(3),(4),(7),(10);
with cte1 as (select * from v3), cte2 as (select * from cte1)
update cte2 set a=11 where a<5;
select * from t1;
a
11
11
11
11
7
10
delete from t1;
insert into t1 values (1),(2),(3),(4),(7),(10);
with cte1 as (select * from v3), cte2 as (select * from cte1 where a>1)
update cte2 set a=11 where a<5;
select * from t1;
a
1
11
11
11
7
10
delete from t1;
insert into t1 values (1),(2),(3),(4),(7),(10);
with cte1 as (select * from v3 where a>0), cte2 as (select * from cte1 where a>1)
update cte2 set a=11 where a<5;
select * from t1;
a
1
11
11
11
7
10
delete from t1;
insert into t1 values (1),(2),(3),(4),(7),(10);
create view v4 as (select * from v2 where b>3);
select * from v4;
b
4
7
# View having view inside which is DT with CTEs
with cte1 as (select * from v4) update cte1 set b=20 where b>5;
select * from t2;
b
4
20
1
3
11
delete from t2;
insert into t2 values (4),(7),(1),(3),(11);
with cte1 as (select * from v4 where b>3) update cte1 set b=0 where b<9;
select * from t2;
b
0
0
1
3
11
delete from t2;
insert into t2 values (4),(7),(1),(3),(11);
with cte1 as (select * from (select * from v4) dt1) update cte1 set b=0 where b<7;
select * from t2;
b
0
7
1
3
11
delete from t2;
insert into t2 values (4),(7),(1),(3),(11);
with cte1 as (select * from (select * from v4) dt1 where b>2) update cte1 set b=0 where b<7;
select * from t2;
b
0
7
1
3
11
delete from t2;
insert into t2 values (4),(7),(1),(3),(11);
with cte1 as (select * from v4), cte2 as (select * from cte1)
update cte2 set b=11 where b>5;
select * from t2;
b
4
11
1
3
11
delete from t2;
insert into t2 values (4),(7),(1),(3),(11);
with cte1 as (select * from v4 where b<15), cte2 as (select * from cte1)
update cte2 set b=11 where b>5;
select * from t2;
b
4
11
1
3
11
delete from t2;
insert into t2 values (4),(7),(1),(3),(11);
with cte1 as (select * from v4 where b<15), cte2 as (select * from cte1 where b>3)
update cte2 set b=11 where b>2;
select * from t2;
b
11
11
1
3
11
delete from t2;
insert into t2 values (4),(7),(1),(3),(11);
# Non-updatable CTEs with base tables only
with cte1 as (select * from t1 union select * from t2) update cte1 set a=0;
ERROR HY000: The target table cte1 of the UPDATE is not updatable
with cte1 as (select * from t1 group by a) update cte1 set a=0;
ERROR HY000: The target table cte1 of the UPDATE is not updatable
with cte1 as (select * from t1 group by a having count(*) >=1) update cte1 set a=0;
ERROR HY000: The target table cte1 of the UPDATE is not updatable
with cte1 as (select DISTINCT * from t1) update cte1 set a=0;
ERROR HY000: The target table cte1 of the UPDATE is not updatable
with cte1 as (select * from t1 limit 1) update cte1 set a=0;
ERROR HY000: The target table cte1 of the UPDATE is not updatable
with cte1 as (select * from t1 union select * from t2 limit 2) update cte1 set a=0;
ERROR HY000: The target table cte1 of the UPDATE is not updatable
with cte1 as (select DISTINCT * from t1 union select * from t2) update cte1 set a=0;
ERROR HY000: The target table cte1 of the UPDATE is not updatable
# Non-updatable CTEs with views containing DT and base table
with cte1 as (select * from v1 union select * from v2) update cte1 set a=0;
ERROR HY000: The target table cte1 of the UPDATE is not updatable
with cte1 as (select * from v1 group by a) update cte1 set a=0;
ERROR HY000: The target table cte1 of the UPDATE is not updatable
with cte1 as (select * from v1 group by a having count(*) >=1) update cte1 set a=0;
ERROR HY000: The target table cte1 of the UPDATE is not updatable
with cte1 as (select DISTINCT * from v1) update cte1 set a=0;
ERROR HY000: The target table cte1 of the UPDATE is not updatable
with cte1 as (select * from v1 limit 1) update cte1 set a=0;
ERROR HY000: The target table cte1 of the UPDATE is not updatable
with cte1 as (select * from v1 union select * from v2 limit 2) update cte1 set a=0;
ERROR HY000: The target table cte1 of the UPDATE is not updatable
with cte1 as (select DISTINCT * from v1 union select * from v2) update cte1 set a=0;
ERROR HY000: The target table cte1 of the UPDATE is not updatable
# Non-updatable CTEs with Embedded views and Embedded DT views
with cte1 as (select * from v3 union select * from v4) update cte1 set a=0;
ERROR HY000: The target table cte1 of the UPDATE is not updatable
with cte1 as (select * from v3 group by a) update cte1 set a=0;
ERROR HY000: The target table cte1 of the UPDATE is not updatable
with cte1 as (select * from v3 group by a having count(*) >=1) update cte1 set a=0;
ERROR HY000: The target table cte1 of the UPDATE is not updatable
with cte1 as (select DISTINCT * from v3) update cte1 set a=0;
ERROR HY000: The target table cte1 of the UPDATE is not updatable
with cte1 as (select * from v3 limit 1) update cte1 set a=0;
ERROR HY000: The target table cte1 of the UPDATE is not updatable
with cte1 as (select * from v3 union select * from v4 limit 2) update cte1 set a=0;
ERROR HY000: The target table cte1 of the UPDATE is not updatable
with cte1 as (select DISTINCT * from v3 union select * from v4) update cte1 set a=0;
ERROR HY000: The target table cte1 of the UPDATE is not updatable
drop table t1, t2;
drop view v1, v2, v3, v4;
